News,Topic,Year
What to Watch for in Fashion in 2017,"trump,clinton,campaign,hillary,republican,",2017
How to Predict Gentrification: Look for Falling Crime,"clinton,department,information,investigation,email,",2017
Farmer on Trial Defends Smuggling Migrants: ‚I Am a Frenchman.‚,"clinton,department,information,investigation,email,",2017
‚James Bond of Philanthropy‚ Gives Away the Last of His Fortune,"clinton,department,information,investigation,email,",2017
"Bitcoin Price Soars, Fueled by Speculation and Global Currency Turmoil","house,bill,care,americans,health,",2017
4 Questioned After Video Shows Racially Charged Beating in Chicago,"clinton,department,information,investigation,email,",2017
"Once Upon a Time, a Guard Nearly Shot Queen Elizabeth by Mistake","trump,clinton,campaign,hillary,republican,",2017
Vermont Governor Pardons 192 for Marijuana Convictions,"clinton,department,information,investigation,email,",2017
"Review: Debbie Reynolds and Carrie Fisher, at Home in ‚Bright Lights‚","trump,clinton,campaign,hillary,republican,",2017
"Putin Led a Complex Cyberattack Scheme to Aid Trump, Report Finds","security,russia,united,administration,obama,",2017
Russian Intervention in American Election Was No One-Off,"security,russia,united,administration,obama,",2017
Russia Requires Apple and Google to Remove LinkedIn From Local App Stores,"city,texas,said,immigration,border,",2017
U.S. Says Russians Were Behind Cyberattacks on Antidoping Agency,"said,attack,north,military,state,",2017
Trump Nominees‚ Filings Threaten to Overwhelm Federal Ethics Office,"city,texas,said,immigration,border,",2017
Trump Meets With Some Vocal Critics: Editors at Vanity Fair and Vogue,"2016,obama,twitter,says,march,",2017
Hospital Confirms Eric Trump Helped Raise $16.3 Million for It,"2016,obama,twitter,says,march,",2017
"Donald Trump, Fort Lauderdale: Your Friday Evening Briefing","2016,obama,twitter,says,march,",2017
California Today: Cracking Down on Distracted Driving,"said,attack,north,military,state,",2017
Westchester County Reacts to Possible Indian Point Shutdown,"said,attack,north,military,state,",2017
Recovery Finally Yields Big Gains for Average Worker‚s Pay,"said,attack,north,military,state,",2017
"Florida Airport Assailant May Have Heard Voices Urging Violence, Officials Say","said,attack,north,military,state,",2017
Is Your Workout Not Working? Maybe You‚re a Non-Responder,"said,attack,north,military,state,",2017
Beating of Disabled Teenager Highlights a Crime That Often Goes Unpunished,"said,attack,north,military,state,",2017
"Andrew Garfield, Spiritual Ghost in the Hollywood Machine","said,attack,north,military,state,",2017
"He Helped Topple a Dictator. In New York, He‚s Another Face in the Crowd.","said,attack,north,military,state,",2017
City to Close or Merge 9 Schools That Were in Support Program,"city,texas,said,immigration,border,",2017
Kerry Lists Obama Era‚s Diplomatic Successes. (Trump Opposes Them All.),"said,attack,north,military,state,",2017
"Friday Mailbag: Taunts, Hoaxes, Anonymity and Stealth","said,attack,north,military,state,",2017
Dozens of Inmates Killed as Prison Violence Escalates in Brazil,"said,attack,north,military,state,",2017
"In Sweden, Happiness in a Shorter Workday Can‚t Overcome the Cost","united,country,government,states,countries,",2017
How to Pounce on Best Credit Card Offers (Before Banks Pull Them),"united,country,government,states,countries,",2017
‚I Thought I Was Impervious to Scams‚: Readers Denounce India‚s Phone Swindlers,"united,country,government,states,countries,",2017
"For Millennials, It‚s Never Too Early to Save for Retirement","united,country,government,states,countries,",2017
Four Movies You Should Know About Before the Golden Globes,"united,country,government,states,countries,",2017
"A Young Mother‚s Solitary, Uphill Struggle","united,country,government,states,countries,",2017
Trump Calls for Closer Relationship Between U.S. and Russia,"security,russia,united,administration,obama,",2017
Senate Confirmation Hearings to Begin Without All Background Checks,"bill,health,care,said,plan,",2017
"In Year Before Florida Shooting, Suspect‚s Problems Multiplied","united,country,government,states,countries,",2017
The Major Potential Impact of a Corporate Tax Overhaul,"said,attack,north,military,state,",2017
Trump Insists Mexico Will Pay for Wall After U.S. Begins the Work,"said,attack,north,military,state,",2017
Scientists Say the Clock of Aging May Be Reversible,"united,country,government,states,countries,",2017
Why You Will Marry the Wrong Person,"united,country,government,states,countries,",2017
"When Killer and Victim‚s Mother Meet, Paths From Grief, Fear and Guilt Emerge","united,country,government,states,countries,",2017
"After One-Child Policy, Outrage at China‚s Offer to Remove IUDs","said,attack,north,military,state,",2017
Naomie Harris: A Chameleon on Screen and Off,"united,country,government,states,countries,",2017
U.S. Consulate Official Shot and Wounded in Mexico,"said,attack,north,military,state,",2017
300 Marines to Aid Fight Against Taliban in Spring,"said,attack,north,military,state,",2017
Brock Osweiler and Texans Knock the Battered Raiders Out of the Playoffs,"united,country,government,states,countries,",2017
"In Turkey‚s Unrest, Some See an Extreme Version of Post-9/11 America","said,attack,north,military,state,",2017
"Light Pillars, a Million-Mirror Optical Illusion on Winter Nights","security,russia,united,administration,obama,",2017
"Tilikum, the Killer Whale Featured in ‚Blackfish,‚ Dies","security,russia,united,administration,obama,",2017
What TV Says About Race and Money,"security,russia,united,administration,obama,",2017
The Making of Virtually Real Art With Google‚s Tilt Brush,"security,russia,united,administration,obama,",2017
Seizing a Second Chance to Graduate From High School,"security,russia,united,administration,obama,",2017
Airstrikes by Russia Buttress Turkey in Battle vs. ISIS,"security,russia,united,administration,obama,",2017
"Donald Trump, Golden Globes, Jerusalem: Your Monday Briefing","security,russia,united,administration,obama,",2017
"In Election Hacking, Julian Assange‚s Years-Old Vision Becomes Reality","2016,obama,twitter,says,march,",2017
Data Could Be the Next Tech Hot Button for Regulators,"security,russia,united,administration,obama,",2017
Russian Hackers Find Ready Bullhorns in the Media,"security,russia,united,administration,obama,",2017
‚What‚s the Big Deal?‚ Ask Trump Voters on Russia Hacking Report,"bill,health,care,said,plan,",2017
"After Fort Lauderdale Shooting, Rumor of Second Gunman Created Chaos","security,russia,united,administration,obama,",2017
Experts Hesitate to Link Florida Airport Attack to PTSD,"security,russia,united,administration,obama,",2017
"At Dylann Roof‚s Trial, a Question of How Many Tears Are Too Many","security,russia,united,administration,obama,",2017
‚La La Land‚ Wins Seven Golden Globes ‚Moonlight‚ Wins Best Drama,"security,russia,united,administration,obama,",2017
Donald Trump Says He‚s Not Surprised by Meryl Streep‚s Golden Globes Speech,"security,russia,united,administration,obama,",2017
Jenna Bush Hager and Michael Keaton Flub Movie Title at Golden Globes,"security,russia,united,administration,obama,",2017
"On the Golden Globes Red Carpet, It‚s Fantasy vs. Reality","clinton,department,information,investigation,email,",2017
Golden Globe Award Winners 2017: The Complete List,"trump,clinton,campaign,hillary,republican,",2017
Can Evolution Have a ‚Higher Purpose‚?,"clinton,department,information,investigation,email,",2017
Steelers Crush Dolphins to Set Up a Clash With the Chiefs,"security,russia,united,administration,obama,",2017
Death of Iran‚s Rafsanjani Removes Influential Voice Against Hard-Liners,"security,russia,united,administration,obama,",2017
"Ayatollah Ali Akbar Hashemi Rafsanjani, Ex-President of Iran, Dies at 82","security,russia,united,administration,obama,",2017
It‚s Right in the Name: Safes Are Safe. Except for Two on New Year‚s Eve.,"security,russia,united,administration,obama,",2017
"North Korea, Rebuking Trump, Says It Can Test Long-Range Missile ‚Anytime‚","security,russia,united,administration,obama,",2017
F.B.I. Arrests Volkswagen Executive on Conspiracy Charge in Emissions Scandal,"security,russia,united,administration,obama,",2017
4 Die in Jerusalem Attack as Palestinian Rams Truck Into Soldiers,"security,russia,united,administration,obama,",2017
‚Hidden Figures‚ Ties ‚Rogue One‚ at Box Office,"trump,clinton,campaign,hillary,republican,",2017
Israeli Embassy Official Plotted to ‚Take Down‚ U.K. Politicians,"security,russia,united,administration,obama,",2017
"Sticker Shock, and Maybe Nausea, Hamper Sales of Virtual Reality Gear","security,russia,united,administration,obama,",2017
Queen Elizabeth II Makes First Public Appearance Since Dec. 9,"united,country,government,states,countries,",2017
"New David Bowie Video Arrives, Hours Before He Would Have Turned 70","united,country,government,states,countries,",2017
Hillary Clinton Receives Ovation at ‚The Color Purple‚,"united,country,government,states,countries,",2017
Ireland Reconsiders Its Constitutional Ban on Abortion,"united,country,government,states,countries,",2017
Rick Ross Documentary Video Doubles as Ad for Checkers,"united,country,government,states,countries,",2017
"Along New York Harbor, ‚On the Waterfront‚ Endures","united,country,government,states,countries,",2017
Seeing America Through ‚àö√Öngel Franco‚s Eyes,"united,country,government,states,countries,",2017
"Review: ‚The Present‚: Even in Russia, It‚s Hard to Turn 40","united,country,government,states,countries,",2017
"A Love Lost, and a Life to Be Regained","said,attack,north,military,state,",2017
"Jared Kushner, a Trump In-Law and Adviser, Chases a Chinese Deal","party,immigration,says,democrats,ryan,",2017
Muted Response From Health Lobby as Affordable Care Act Faces Repeal,"said,attack,north,military,state,",2017
Women‚s March on Washington Opens Contentious Dialogues About Race,"united,country,government,states,countries,",2017
"Betsy DeVos, Trump‚s Education Pick, Plays Hardball With Her Wealth","said,attack,north,military,state,",2017
Anonymous Bomb Threats Rattle Jewish Centers Across Eastern U.S.,"united,country,government,states,countries,",2017
American Destroyer Fires Warning Shots at Iranian Boats,"united,country,government,states,countries,",2017
"In Address, Cuomo Posits New York‚s Policies as an Answer to Trump","united,country,government,states,countries,",2017
"U.S. Blacklists 5 Russians, a Close Putin Aide Among Them","party,immigration,says,democrats,ryan,",2017
Here‚s How Clemson Won the College Football Playoff Championship,"united,country,government,states,countries,",2017
"Israel Buries 4 Soldiers, but the Mourning Is Marred by Discord","said,attack,north,military,state,",2017
Volkswagen Executive‚s Trip to U.S. Allowed F.B.I. to Pounce,"court,law,department,case,justice,",2017
Steelers Crush Dolphins to Set Up a Clash With the Chiefs,"united,country,government,states,countries,",2017
Death of Iran‚s Rafsanjani Removes Influential Voice Against Hard-Liners,"said,attack,north,military,state,",2017
"Ayatollah Ali Akbar Hashemi Rafsanjani, Ex-President of Iran, Dies at 82","said,attack,north,military,state,",2017
It‚s Right in the Name: Safes Are Safe. Except for Two on New Year‚s Eve.,"united,country,government,states,countries,",2017
"North Korea, Rebuking Trump, Says It Can Test Long-Range Missile ‚Anytime‚","said,attack,north,military,state,",2017
F.B.I. Arrests Volkswagen Executive on Conspiracy Charge in Emissions Scandal,"court,law,department,case,justice,",2017
4 Die in Jerusalem Attack as Palestinian Rams Truck Into Soldiers,"said,attack,north,military,state,",2017
‚Hidden Figures‚ Ties ‚Rogue One‚ at Box Office,"united,country,government,states,countries,",2017
Israeli Embassy Official Plotted to ‚Take Down‚ U.K. Politicians,"united,country,government,states,countries,",2017
"Sticker Shock, and Maybe Nausea, Hamper Sales of Virtual Reality Gear","united,country,government,states,countries,",2017
"Venturi VBB-3: 3,000-horsepower electric car goes 340 mph","party,immigration,says,democrats,ryan,",2017
Is there anything cuter than these tiny NICU tots in Halloween costumes?,"party,immigration,says,democrats,ryan,",2017
‚Inferno‚ doesn‚t generate much heat,"party,immigration,says,democrats,ryan,",2016
Mom overdoses in car with baby in backseat,"party,immigration,says,democrats,ryan,",2016
"Oklahoma manhunt: ‚It was all a setup,‚ fugitive says on Facebook Live",none,2016
NATO bolsters presence in Eastern Europe as Russia tension rises,"party,immigration,says,democrats,ryan,",2016
How the Latino vote could affect the 2016 race,"party,immigration,says,democrats,ryan,",2016
Yemen food crisis leaves millions at risk of starving,"attack,war,state,islamic,isis",2016
Calais Jungle: Unregistered kids in limbo,"party,immigration,says,democrats,ryan,",2016
"Syrian airstrikes hit school, killing 20 children, rescuers say","party,immigration,says,democrats,ryan,",2016
Dakota Access Pipeline: Police remove protesters,"party,immigration,says,democrats,ryan,",2016
Florida voting already surpasses entire 2000 election total,"women,black,people,university,students,",2016
Where and how to find CNN on Election Day,"security,russia,united,administration,obama,",2016
This NASA astronaut voted from space,"party,immigration,says,democrats,ryan,",2016
Viewers‚ guide: Who will control the Senate?,"trump,president,house,said,russia,",2016
"To triumph and tragedy, Reno followed law","party,immigration,says,democrats,ryan,",2016
"#MyVote: 50 stickers, 50 states and you","party,immigration,says,democrats,ryan,",2016
Early voting data suggests Clinton lags in North Carolina compared to 2012,"women,black,people,university,students,",2016
Reality Check: No assassination attempt,"party,immigration,says,democrats,ryan,",2016
Election Day forecast: Rain possible for a few key states,"party,immigration,says,democrats,ryan,",2016
"No, you can‚t vote by text message","women,black,people,university,students,",2016
"Clinton, Trump make final pitches","party,immigration,says,democrats,ryan,",2016
The other election week story,"party,immigration,says,democrats,ryan,",2016
"Ohio man arrested, accused of trying to join ISIS","attack,war,state,islamic,isis",2016
Five states consider legalizing marijuana,"party,immigration,says,democrats,ryan,",2016
"Nicaraguan President wins fourth term, with wife as VP","party,immigration,says,democrats,ryan,",2016
"Janet Reno‚s career punctuated by highs, lows","party,immigration,says,democrats,ryan,",2016
Supreme Court won‚t restore court order against Trump over poll-watching in Ohio,"said,attack,north,military,state,",2016
Obama‚s last campaign,"party,immigration,says,democrats,ryan,",2016
Trump reflects on his bid: ‚It‚s been some campaign‚,"party,immigration,says,democrats,ryan,",2016
Why I‚m voting for the first time,"party,immigration,says,democrats,ryan,",2016
"Oklahoma earthquake forces evacuations, school closures","party,immigration,says,democrats,ryan,",2016
"Venturi VBB-3: 3,000-horsepower electric car goes 340 mph","party,immigration,says,democrats,ryan,",2016
Is there anything cuter than these tiny NICU tots in Halloween costumes?,"party,immigration,says,democrats,ryan,",2016
‚Inferno‚ doesn‚t generate much heat,"party,immigration,says,democrats,ryan,",2016
Mom overdoses in car with baby in backseat,"party,immigration,says,democrats,ryan,",2016
"Oklahoma manhunt: ‚It was all a setup,‚ fugitive says on Facebook Live",none,2016
NATO bolsters presence in Eastern Europe as Russia tension rises,"party,immigration,says,democrats,ryan,",2016
How the Latino vote could affect the 2016 race,"party,immigration,says,democrats,ryan,",2016
Yemen food crisis leaves millions at risk of starving,"party,immigration,says,democrats,ryan,",2016
Calais Jungle: Unregistered kids in limbo,"party,immigration,says,democrats,ryan,",2016
"Syrian airstrikes hit school, killing 20 children, rescuers say","party,immigration,says,democrats,ryan,",2016
Dakota Access Pipeline: Police remove protesters,"party,immigration,says,democrats,ryan,",2016
Florida voting already surpasses entire 2000 election total,"women,black,people,university,students,",2016
Where and how to find CNN on Election Day,"security,russia,united,administration,obama,",2016
This NASA astronaut voted from space,"party,immigration,says,democrats,ryan,",2016
Viewers‚ guide: Who will control the Senate?,"trump,president,house,said,russia,",2016
"To triumph and tragedy, Reno followed law","party,immigration,says,democrats,ryan,",2016
"#MyVote: 50 stickers, 50 states and you","party,immigration,says,democrats,ryan,",2016
Early voting data suggests Clinton lags in North Carolina compared to 2012,"women,black,people,university,students,",2016
Reality Check: No assassination attempt,"party,immigration,says,democrats,ryan,",2016
Election Day forecast: Rain possible for a few key states,"party,immigration,says,democrats,ryan,",2016
"No, you can‚t vote by text message","women,black,people,university,students,",2016
"Clinton, Trump make final pitches","party,immigration,says,democrats,ryan,",2016
The other election week story,"party,immigration,says,democrats,ryan,",2016
"Ohio man arrested, accused of trying to join ISIS","clinton,department,information,investigation,email,",2016
Five states consider legalizing marijuana,"party,immigration,says,democrats,ryan,",2016
"Nicaraguan President wins fourth term, with wife as VP","party,immigration,says,democrats,ryan,",2016
"Janet Reno‚s career punctuated by highs, lows","party,immigration,says,democrats,ryan,",2016
Supreme Court won‚t restore court order against Trump over poll-watching in Ohio,"trump,president,house,said,russia,",2016
Obama‚s last campaign,"party,immigration,says,democrats,ryan,",2016
Trump reflects on his bid: ‚It‚s been some campaign‚,"trump,clinton,campaign,hillary,republican,",2016
Why I‚m voting for the first time,"party,immigration,says,democrats,ryan,",2016
"Oklahoma earthquake forces evacuations, school closures","party,immigration,says,democrats,ryan,",2016
Why hasn‚t Trump‚s transition team called the Pentagon?,"security,russia,united,administration,obama,",2016
Former Malaysian PM Mahathir throws weight behind rally to oust leader Najib,"attack,war,state,islamic,isis",2016
Salmonella concern prompts cheese recall,"party,immigration,says,democrats,ryan,",2016
Early Trump-world lesson: Don‚t cross Jared Kushner,"trump,clinton,campaign,hillary,republican,",2016
Trump must address conflicts of interest,"trump,news,twitter,2016,breitbart,",2016
"Arctic, Antarctic sea ice at record lows",none,2016
US marshal killed in shootout with suspect,"attack,war,state,islamic,isis",2016
Obama leaves Europe with little certitude,"women,black,people,university,students,",2016
How Jeff Sessions could change the Justice Department,"united,country,government,states,countries,",2016
Vince Neil now says he‚s not playing at inauguration,"party,immigration,says,democrats,ryan,",2016
New Zealand quake lifted sea floor 2 meters,"attack,war,state,islamic,isis",2016
Giuliani defends foreign business ties: ‚Comparisons to Hillary Clinton are nuts‚,"clinton,department,information,investigation,email,",2016
Trump asks Rep. Mike Pompeo to be CIA director,"security,russia,united,administration,obama,",2016
ATP Finals: Resilient Murray wears down Wawrinka,"party,immigration,says,democrats,ryan,",2016
Keeping kids safe from hazardous toys,"united,country,government,states,countries,",2016
"Haha guys, this bird looks like Donald Trump","trump,clinton,campaign,hillary,republican,",2016
WHO ends Zika public health emergency,"trump,news,twitter,2016,breitbart,",2016
"Lose election bet, get a Trump tattoo","clinton,department,information,investigation,email,",2016
Allegations of racism against Sessions: a closer look,"security,russia,united,administration,obama,",2016
Sorority-girl vigilantes break ‚good girl/bad guy‚ taboos,"party,immigration,says,democrats,ryan,",2016
Where liberals will run to hide from Trump,"trump,news,twitter,2016,breitbart,",2016
Cruz: Election was revenge of ‚flyover country‚,"clinton,department,information,investigation,email,",2016
North Carolina GOP condemns KKK parade honoring Trump,"trump,news,twitter,2016,breitbart,",2016
What is Trump‚s staff doing in Washington?,"trump,clinton,campaign,hillary,republican,",2016
Mexico urges migrants in US to ‚be calm‚,"party,immigration,says,democrats,ryan,",2016
Civil rights groups denounce Sessions as AG,"party,immigration,says,democrats,ryan,",2016